,Komentar,label,truncated_label,sentiment,score
904,menteri pendidikan gak usah aneh deh buat program seperti marketplace guru solusi sejahtera guru itu simple  non spd dilarang daftar guru  hapus sertifikasi guru  naikkan gaji guru,POSITIVE,b the minister of education doesn t have to be weird to create programs like the teacher marketplace the solution for teacher welfare is simple non SPD is prohibited from registering teachers removing teacher certification increasing teacher salaries,"[{'label': 'POSITIVE', 'score': 0.9680866003036499}]",0.9680866003036499
905,lagi garap skripsi terus liat berita mengenai marketplace guru jadi guru udah kek dagangan sekolah tinggal checkout guru eehhh yang di co sanak saudaranya sendiri terus nasib guru yang gak punya apa yang niatnya mau mengabdi mengajar harus jadi pengangguran gitu,NEGATIVE,when I m working on my thesis I see news about the teacher s marketplace so I m already a teacher I just have to check out my school s merchandise uhh the teacher s co workers then the fate of a teacher who doesn t have anything whose intention is to serve teaching must be unemployed,"[{'label': 'NEGATIVE', 'score': 0.9973515272140503}]",0.9973515272140503
906,busyet marketplace guru,NEGATIVE,b busyet marketplace guru,"[{'label': 'NEGATIVE', 'score': 0.9704809188842773}]",0.9704809188842773
907,apa itu marketplace perekrutan guru begini penjelasannya  ,NEGATIVE,b what is a teacher recruitment marketplace here s the explanation,"[{'label': 'NEGATIVE', 'score': 0.9979865550994873}]",0.9979865550994873
908,nadiem makarim akan rekrut guru melalui marketplace gimana caranya  ,POSITIVE,Nadiem Makarim will recruit teachers through the marketplace how do you do that,"[{'label': 'POSITIVE', 'score': 0.9979093670845032}]",0.9979093670845032
909,unpopular opinion disaat orang lain pada hujat pak nadim tentang kebijakan marketplace guru entah kenapa aku yakin maksud beliau itu baik mungkin memang istilahnya aja yg kurang tepat seakan tidak menghargai guru tapi all of that aku yakin beliau punya niat yg baik,NEGATIVE,b unpopular opinion when other people blaspheme Pak Nadim about the teacher s marketplace policy somehow I m sure he means well maybe it s just the term that s not quite right as if he doesn t respect teachers but all of that I m sure he has good intentions,"[{'label': 'NEGATIVE', 'score': 0.9518238306045532}]",0.9518238306045532
910,guru masuk marketplace mantap hehehe,POSITIVE,b guru enters marketplace great hehehe,"[{'label': 'POSITIVE', 'score': 0.9945293068885803}]",0.9945293068885803
911,pgri marketplace guru adalah solusi percepat ketersediaan guru sesuai dengan kebutuhan ,POSITIVE,b pgri teacher marketplace is a solution to accelerate the availability of teachers according to needs,"[{'label': 'POSITIVE', 'score': 0.9442144632339478}]",0.9442144632339478
912,database guru yang kompeten profesional dalam sistem marketplace yang akan diberlakukan mulai  adalah positif ,POSITIVE,b database of professional competent teachers in the marketplace system that will be put into effect is positive,"[{'label': 'POSITIVE', 'score': 0.9996987581253052}]",0.9996987581253052
913,ditengah banyak konten media sosial guru dan calon guru yang kontra tentang rencana tentang marketplace guru ternyata ada komentar dari kang dede yusuf selaku komisi x yang menyambut dengan positif ,POSITIVE,b in the midst of lots of social media content for teachers and prospective teachers who are against the plan for the teacher marketplace it turns out that there is a comment from Kang Dede Yusuf as Commission X who welcomes it positively,"[{'label': 'POSITIVE', 'score': 0.9021611213684082}]",0.9021611213684082
914,sedinya ly sistem kaya marketplace ini uda diterapin di agen guru les tempat aku ngajar  jadi ada profiledatabase guru calon murid nyari guru kita apply ya uda tar dipilih suka dah,NEGATIVE,The difference is that the marketplace like system has already been implemented at the tutoring agency where I teach so there is a teacher database profile Prospective students are looking for teachers we ll apply right,"[{'label': 'NEGATIVE', 'score': 0.996359646320343}]",0.996359646320343
915,marketplace guru disambut positif oleh ketua pgri jawa timur teguh sumarno menurutnya dengan lebih dari  juta guru untuk lolos program pppk adalah niat baik pemerintah ,POSITIVE,teacher b marketplace was positively welcomed by the chairman of the East Java Pgri firm Sumarno according to him with more than a million teachers passing the PPPK program is the government s good intention,"[{'label': 'POSITIVE', 'score': 0.9989898800849915}]",0.9989898800849915
916,pgri dukung program marketplace guru untuk percepatan ketersedian guru sesuai kebutuhan ,POSITIVE,b pgri supports the teacher marketplace program to accelerate the availability of teachers as needed,"[{'label': 'POSITIVE', 'score': 0.9969310760498047}]",0.9969310760498047
917,reaksi mendikbud diminta penjelasan soal marketplace guru ,NEGATIVE,b reaction of Minister of Education and Culture asked for explanation about teacher marketplace,"[{'label': 'NEGATIVE', 'score': 0.9582235217094421}]",0.9582235217094421
918,marketplace guru menjadi salah satu solusi yang ditawarkan nadiem makarim dan kemendikbud ristek yang bertujuan untuk memenuhi kebutuhan guru di indonesia ,POSITIVE,b marketplace for teachers is one of the solutions offered by Nadem Makarim and the Ministry of Education and Culture which aims to meet the needs of teachers in Indonesia,"[{'label': 'POSITIVE', 'score': 0.9635346531867981}]",0.9635346531867981
919,jadi dengan marketplace tersebut  data talent guru akan lebih terdokumentasi dengan baik sekolah bisa langsung mencari guru sesuai kebutuhan guru pun bisa mencari formasi sesuai keahlian dan lokasi yang diharapkan,NEGATIVE,b so with this marketplace teacher talent data will be better documented schools can immediately look for teachers according to the needs of teachers they can look for formations according to the expertise and location expected,"[{'label': 'NEGATIVE', 'score': 0.9941403269767761}]",0.9941403269767761
920,jadi marketplace itu istilah umum yg dipake untuk platform yg mempertemukan demand dan suplly hal ini untuk memecahkan kebuntuan terkait kebutuhan guru formasi guru dan kebutuhan sekolah ,POSITIVE,b So the marketplace is a general term used for a platform that brings together demand and supply of this to solve an impasse related to teacher needs teacher formation and school needs,"[{'label': 'POSITIVE', 'score': 0.7917709946632385}]",0.7917709946632385
921,pada rame ngrespon soal marketplace guru yg disampaikan di rdp komisi x dpr yg bikin mara mara adl kata marketplace tanpa membaca lebih lanjut padahal ,NEGATIVE,b when there are a lot of people responding to the teacher s marketplace that was conveyed at the rdp commission x dpr which made a lot of noise was the word marketplace without reading further even though,"[{'label': 'NEGATIVE', 'score': 0.9950495362281799}]",0.9950495362281799
922,marketplace guru ,POSITIVE,b marketplace guru,"[{'label': 'POSITIVE', 'score': 0.9690628051757812}]",0.9690628051757812
923,lagi rame konten marketplace guru nemu komen agak laen hadehhh mba zainab kualitas sdm masa iya harus jadi tanggung jawab guru lagi kerja guru harus  jam kah sampe ngawasin muridnya pas di rumah lalu fungsi keluarga untuk apa  ,NEGATIVE,b the teacher s marketplace content is crowded again I found comments that are a bit different hadehhh mba zainab the quality of the human resources right It should be the teacher s responsibility the teacher has to work hours do they have to supervise their students right at home then what is the function of the family,"[{'label': 'NEGATIVE', 'score': 0.9783767461776733}]",0.9783767461776733
924,nadiem makarim buat sistem rekrutmen guru pppk melalui marketplace begini respons dpr ,NEGATIVE,Nadiem Makarim for the PPPK teacher recruitment system through the marketplace this is the DPR s response,"[{'label': 'NEGATIVE', 'score': 0.9710690379142761}]",0.9710690379142761
925,guru diposting neng marketplace,NEGATIVE,b guru posted by marketplace,"[{'label': 'NEGATIVE', 'score': 0.985353410243988}]",0.985353410243988
926,pr baru ni ada marketplace buat guru ayo pelajari dulu deh baru berani kritik xixi,NEGATIVE,b pr recently there is a marketplace for teachers let s learn first then dare to criticize xixi,"[{'label': 'NEGATIVE', 'score': 0.9850072264671326}]",0.9850072264671326
927,lah mereka yg terdaftar di marketplace itu juga bukan sembarangan orang mereka yg terdaftar kan bener guru yg punya kompetensi tinggi dan tentunya punya jam terbang juga kalopun misal kepsek nya ambil org terdekat dia yakan tetep yg dia ambil org yg kompeten juga,NEGATIVE,b lah those who are registered on the marketplace are also not just random people those who are registered are really teachers who have high competence and of course have experience too,"[{'label': 'NEGATIVE', 'score': 0.9972345232963562}]",0.9972345232963562
928,news terpopuler ekspor pasir laut dibuka rekrutmen guru lewat marketplace ,POSITIVE,b news the most popular export of sea sand opens recruitment of teachers through the marketplace,"[{'label': 'POSITIVE', 'score': 0.9918003678321838}]",0.9918003678321838
929,news terpopuler ekspor pasir laut dibuka rekrutmen guru lewat marketplace ,POSITIVE,b news the most popular export of sea sand opens recruitment of teachers through the marketplace,"[{'label': 'POSITIVE', 'score': 0.9918003678321838}]",0.9918003678321838
930,solusi atasi kekurangan tenaga pendidik ala nadiem makarim salah satunya bakal ada marketplace guru ,POSITIVE,b the solution to overcome the shortage of educators in the style of Nadiem Makarim one of which will be a teacher s marketplace,"[{'label': 'POSITIVE', 'score': 0.879859983921051}]",0.879859983921051
931,ketua pgri jatim dukung program menteri nadiem marketplace guru target  juta guru lolos pppk ,NEGATIVE,b chair of Pgri Jatim supports Minister Nadiem Marketplace teacher program targeting million teachers pass PPPK,"[{'label': 'NEGATIVE', 'score': 0.9506655335426331}]",0.9506655335426331
932,pgri dukung marketplace guru bagi teguh dngn cara apapun dilakukan demi martabat guru amp keberlangsungan sukses layanan pendidikan bagi setiap anak didik jadi hanya sekolahan yang tahu persis kebutuhan guru dan guru mata pelajaran apa yang dibutuhkan ucapnya ,NEGATIVE,B Pgri supports the teacher marketplace for being persistent in any way it is done for the dignity of teachers the successful continuation of education services for each student so only schools know exactly what teacher and subject teachers need he said,"[{'label': 'NEGATIVE', 'score': 0.6270003318786621}]",0.6270003318786621
933,mendikbud siapkan sistem marketplace untuk guru seperti apa sih ,POSITIVE,b mendikbud prepares a marketplace system for teachers,"[{'label': 'POSITIVE', 'score': 0.9905357956886292}]",0.9905357956886292
934,pgri dukung marketplace guru marketplace guru diangga solusi tercepat untuk memenuhi ketersedian guru sesuai dengan kebutuhan ,POSITIVE,b pgri supports teacher marketplace teacher marketplace is considered the fastest solution to meet the availability of teachers according to needs,"[{'label': 'POSITIVE', 'score': 0.998537540435791}]",0.998537540435791
935,grgr guru marketplace misal nanti snbt lolosnya pil  apa ga gue ambil aja ya,NEGATIVE,b grgr guru marketplace for example later if you pass the pill or not I ll just take it okay,"[{'label': 'NEGATIVE', 'score': 0.9703245162963867}]",0.9703245162963867
936,tak hanya guru nadiem makarim sebut marketplace guru bermanfaat bagi sekolah nadiem makarim menjelaskan marketplace guru nantinya akan menjadi basis data yang di mana sekolah bisa mengakses setiap calon guru ,NEGATIVE,b not only teacher Nadiem Makarim calls the teacher marketplace useful for schools Nadem Makarim explains that the teacher marketplace will later become a database where schools can access every prospective teacher,"[{'label': 'NEGATIVE', 'score': 0.9817124009132385}]",0.9817124009132385
937,tolong dong adain demo soal marketplace guru,NEGATIVE,b please do a demo about guru marketplace,"[{'label': 'NEGATIVE', 'score': 0.9829913377761841}]",0.9829913377761841
938,gpt guru supports the establishment of nft marketplaces how do you think nfts will transform the concept of digital ownership in the future and how does gpt guru assist creators in adapting to this new environment,POSITIVE,b gpt guru supports the establishment of nft marketplaces how do you think nfts will transform the concept of digital ownership in the future and how does gpt guru assist creators in adapting to this new environment,"[{'label': 'POSITIVE', 'score': 0.9973719120025635}]",0.9973719120025635
939,ok marketplace buat gurucalon guru jangan lupa checkout ,POSITIVE,b ok marketplace for teachers prospective teachers don t forget to checkout,"[{'label': 'POSITIVE', 'score': 0.9939392805099487}]",0.9939392805099487
940,mendikbud ristek nadiem makarim bakal pakai sistem marketplace untuk rekrutmen guru apa maksudnya ,NEGATIVE,b Minister of Education and Culture Nadiem Makarim will use the marketplace system to recruit teachers what does that mean,"[{'label': 'NEGATIVE', 'score': 0.8955496549606323}]",0.8955496549606323
941,kalo gini nangis kejer sih mana sekarang ada program apa tuh yang marketplace guru juga wkwk,NEGATIVE,b if it s like this where are you crying right now what program is the teacher s marketplace too wkwk,"[{'label': 'NEGATIVE', 'score': 0.9988788962364197}]",0.9988788962364197
942,marketplace ini bagus sebenernya ngak ada lagi guru honorer titipan kepala sekolah  karna syaratnya wajib lulus ppg lulus ppp pppk kedepan akan berdampak positif untuk kualitas pendidikan,POSITIVE,this marketplace is good actually there are no honorary teachers entrusted by the principal because the requirement is to pass ppg pass ppp pppk in the future it will have a positive impact on the quality of education,"[{'label': 'POSITIVE', 'score': 0.9982421398162842}]",0.9982421398162842
943,marketplace guru sistem rekrutmen tenaga pendidik solusi atau masalah baru ,NEGATIVE,b marketplace teacher educator recruitment system new solutions or problems,"[{'label': 'NEGATIVE', 'score': 0.99471116065979}]",0.99471116065979
944,mas nadiem akan coba proses rekerutmen guru kyk di marketplace ,NEGATIVE,b mas Nadiem will try the teacher recruitment process like in the marketplace,"[{'label': 'NEGATIVE', 'score': 0.9698861241340637}]",0.9698861241340637
945, mendikbud nadiem marketplace guru beri manfaat positif bagi guru dan sekolah  ,POSITIVE,b Mendikbud Nadiem Teacher marketplace provides positive benefits for teachers and schools,"[{'label': 'POSITIVE', 'score': 0.9996532201766968}]",0.9996532201766968
946,semakin kesini semakin ngadi ngadi dunia pendidikan di indonesia setelah marketplace guru apalagi solusi ambyarnya,POSITIVE,b the more you come here the more you make an impact on the world of education in Indonesia after the teacher marketplace let alone the abysmal solution,"[{'label': 'POSITIVE', 'score': 0.9986807703971863}]",0.9986807703971863
947,kalo di marketplace kan yg di co yang paling murah kl gt ga nyelesaiin masalah gaji guru kecil dong ,NEGATIVE,b if it s in the marketplace is it the one in Co that s the cheapest if it doesn t solve the small teacher s salary problem please,"[{'label': 'NEGATIVE', 'score': 0.9993923902511597}]",0.9993923902511597
948,tangani masalah perekrutan guru nadiem bakal buat marketplace guru   ,POSITIVE,b handling the problem of recruiting Nadiem teachers will create a teacher marketplace,"[{'label': 'POSITIVE', 'score': 0.9765672087669373}]",0.9765672087669373
949,marketplace guru nih program yang tidak menguntungkan untuk para guru dan para mahasiswa yang ambil jurusan pendidikan dimana yang di pilih nanti yang sudah kuliah ppg kalau belum jauh jauh dari di pilih oleh pihak sekolah kalaupun di butuhkan mungkin di taruh di keranjang dulu,NEGATIVE,b marketplace teacher is a program that is not profitable for teachers and students who are majoring in education where those who are chosen later who are already in ppg college if it is not far from being chosen by the school even if it is needed maybe put it in the basket first,"[{'label': 'NEGATIVE', 'score': 0.9998102784156799}]",0.9998102784156799
950,marketplace check out emgnya guru barang dagangan apa ya,NEGATIVE,marketplace check out what kind of merchandise are you teachers,"[{'label': 'NEGATIVE', 'score': 0.9686314463615417}]",0.9686314463615417
951,ini apalagi guru pake marketplace dikira barang kali anying,NEGATIVE,b this is moreover the teacher uses the marketplace it is thought that the goods are anying,"[{'label': 'NEGATIVE', 'score': 0.9811996221542358}]",0.9811996221542358
952,sistem ini rencananya mulai diberlakukan pada  mendatang secara permanen nadiem menjabarkan tiga pilar solusi yang akan diterapkan pada  sebagai sistem rekrutmen guru pppk pertama konsep marketplace untuk guru,POSITIVE,b this system is planned to be implemented in the future permanently Nadem outlines the three pillars of the solution that will be implemented as the first PPPK teacher recruitment system with the marketplace concept for teachers,"[{'label': 'POSITIVE', 'score': 0.8622221946716309}]",0.8622221946716309
953,ditunggu dlu aja sih mungkin nanti akan ada istilah baru lagi untuk marketplace guru ini,NEGATIVE,b just wait maybe later there will be a new term for this teacher marketplace,"[{'label': 'NEGATIVE', 'score': 0.9986862540245056}]",0.9986862540245056
954,sekolah ambil guru di marketplace guru bayarnya paylater,NEGATIVE,b school hires teachers in marketplace teachers pay paylater,"[{'label': 'NEGATIVE', 'score': 0.9940819144248962}]",0.9940819144248962
955,beberapa hari terakhir ramai diberitakan mengenai marketplace guru yang merupakan gagasan dari menteri pendidikan kebudayaan riset dan teknologi mendikbudristek nadiem makarim tapi apa sebenarnya marketplace guru bagaimana sistemnya baca disini ya ,POSITIVE,b the last few days there has been a lot of news about the teacher marketplace which was the brainchild of the minister of education culture research and technology the Minister of Education and Culture Nadiem Makarim but what exactly is a teacher marketplace how is the system read here ok,"[{'label': 'POSITIVE', 'score': 0.9289429783821106}]",0.9289429783821106
956,ini pada gak ada yg ngomongin marketplace guru ya pro dan konsnya how dan dampak buat guru gmn,NEGATIVE,b no one s talking about the teacher s marketplace what are the pros and cons and what s the impact on teachers,"[{'label': 'NEGATIVE', 'score': 0.9986035227775574}]",0.9986035227775574
957,semoga nanti di marketplace guru siswa yg bisa kasih rating amp feedback ke guru bukan kepala sekolahnya dulu gw pas sekolah dengan mata kepala gw menyaksikan ini guru pns ga bisa ngajar mata duitan amp digaji lebih besar dibanding honorer yg kualitasnya jauh lebih baik,NEGATIVE,b hopefully later in the marketplace it will be student teachers who can give ratings feedback to teachers not the principal of the school I used to watch this with my own eyes when I was at school civil servant teachers can t teach money making skills are paid a lot more than honorariums whose quality is much better,"[{'label': 'NEGATIVE', 'score': 0.9836665391921997}]",0.9836665391921997
958,sekarang jamannya checkout barang di shoope tahun depan checkout guru di marketplace guru,NEGATIVE,Now is the time to checkout goods at Shopee Next year checkout teachers at marketplace Guru,"[{'label': 'NEGATIVE', 'score': 0.7650469541549683}]",0.7650469541549683
959,rekrutmen guru lewat marketplace mulai  apa saja keuntungannya ,POSITIVE,bi recruiting teachers through the marketplace what are the advantages,"[{'label': 'POSITIVE', 'score': 0.976141095161438}]",0.976141095161438
960,bagaimana teknis marketplace guru intip  poin yang wajib diketahui penjelasan lengkap terkait teknis marketplace guru program yang diusulkan mendikbud untuk bantu nasib honorer ,POSITIVE,b what about the technical aspects of the teacher marketplace a peek at the points that must be known a complete explanation regarding the technical aspects of the teacher marketplace the program proposed by the Minister of Education and Culture to help honorary workers,"[{'label': 'POSITIVE', 'score': 0.8332130312919617}]",0.8332130312919617
961,nih pak mentri urusin dulu deh guru yang ngurus masalah gini gak becus daripada koar soal marketplace guru sedih banget liatnya kalo diposisi orang tua anak itu,NEGATIVE,minister take care of it first the teacher who takes care of this problem is no better than boasting about the teacher s marketplace it s really sad to see that the child s parents are in that position,"[{'label': 'NEGATIVE', 'score': 0.9965272545814514}]",0.9965272545814514
962,marketplace untuk guru ini sebenernya bagus konsepnya cuma sayangnya orang orang pada fokus sama kata marketplace kesannya kurang pas ya sama orang kita yang cukup perhatian sama nama project gini,NEGATIVE,b marketplace for teachers is actually a good concept it s just a shame that people are focused on the word marketplace the impression is not quite right for our people who are quite concerned about the name of the project like this,"[{'label': 'NEGATIVE', 'score': 0.9575568437576294}]",0.9575568437576294
963,ngeliat kek ginian jadi pengen setujuin marketplace guru,NEGATIVE,b seeing that kind of cake makes me want to be approved by marketplace guru,"[{'label': 'NEGATIVE', 'score': 0.745826005935669}]",0.745826005935669
964,marketplace guru  dalam mengatasi problematika kualitas dan ketimpangan guru pemerintah harus memastikan kehadiran guru yang merata di setiap jangkal tanah air indonesia,POSITIVE,b marketplace of teachers in addressing the problem of teacher quality and inequality the government must ensure that the presence of teachers is evenly distributed in every area of Indonesia s homeland,"[{'label': 'POSITIVE', 'score': 0.996799111366272}]",0.996799111366272
965,rekrutmen guru bakal lewat marketplace mulai  ,NEGATIVE,bi teacher recruitment will go through the marketplace starting,"[{'label': 'NEGATIVE', 'score': 0.8494200110435486}]",0.8494200110435486
966,kak ga mau bahas tentang marketplace untuk guru,NEGATIVE,bro don t want to talk about the marketplace for teachers,"[{'label': 'NEGATIVE', 'score': 0.9887922406196594}]",0.9887922406196594
967,marketplace guru dari diksinya saja sudah tidak menghargai guru,NEGATIVE,the teacher marketplace from the diction alone no longer respects teachers,"[{'label': 'NEGATIVE', 'score': 0.9997062087059021}]",0.9997062087059021
968,marketplace guru kurikulum merdeka makin males gw buat nyelesein skripsi,NEGATIVE,b marketplace independent curriculum teachers are increasingly lazy for me to finish my thesis,"[{'label': 'NEGATIVE', 'score': 0.9996386766433716}]",0.9996386766433716
969,marketplace guru jadi terobosan baru proses rekrutmen ala nadiem makarim sekolah bisa checkout sesuka hati tag ibox denny indrayana cawecawe diabetes laurier ,POSITIVE,Teacher s b marketplace is a new breakthrough in the recruitment process in the style of Nadiem Makarim Schools can checkout as they please tag ibox Denny Indrayana Cawecawe Diabetes Laurier,"[{'label': 'POSITIVE', 'score': 0.999024510383606}]",0.999024510383606
970,skrg lagi pusing dgn kehidupan pribadi ditambah lg kepusingan dgn drama pk yang tak kunjung kelar ehh nambah lg drama baru marketplace guru,POSITIVE,b now I m getting dizzy with my personal life plus I m getting dizzy with drama pk that won t finish yet add more drama new marketplace guru,"[{'label': 'POSITIVE', 'score': 0.7886614799499512}]",0.7886614799499512
971,kita sebagai pekerja tahu maksud marketplace guru adalah untuk database talent poll gurutapi redaksi marketplace sangat rentan disalahartikanapalagi rawan akan praktek nepotisme dikalangan pendidikan,NEGATIVE,b we as workers know the purpose of the teacher marketplace is for the teacher talent poll database but marketplace editors are very prone to being misunderstood especially prone to nepotism in education circles,"[{'label': 'NEGATIVE', 'score': 0.9971976280212402}]",0.9971976280212402
972,marketplace guru gk ada kata yang lebih bagus dan terhormat lagi apa ya selain marketplace _,NEGATIVE,teacher marketplace there is no better and more respectable word than marketplace,"[{'label': 'NEGATIVE', 'score': 0.9967941641807556}]",0.9967941641807556
973,gpt guru enables the creation of nft marketplaces what impact do you foresee nfts having on the future of digital ownership and how does gpt guru support creators in navigating this emerging landscape,POSITIVE,b gpt guru enables the creation of nft marketplaces what impact do you foresee nfts having on the future of digital ownership and how does gpt guru support creators in navigating this emerging landscape,"[{'label': 'POSITIVE', 'score': 0.9991738200187683}]",0.9991738200187683
974,coba itu marketplace guru cenah  ,NEGATIVE,b try it marketplace guru cenah,"[{'label': 'NEGATIVE', 'score': 0.9933360815048218}]",0.9933360815048218
975,kuliah lagi susahnya denger berita marketplace guru memang anj,NEGATIVE,I m still in college it s hard to hear news about the teacher s marketplace really,"[{'label': 'NEGATIVE', 'score': 0.9972103238105774}]",0.9972103238105774
976,gila gua nyesek bgt sama kebijakan baru menteri pendidikan marketplace buat guru hah speechless,NEGATIVE,b crazy I m so sorry for the minister of education s new policy of marketplace for teachers hah speechless,"[{'label': 'NEGATIVE', 'score': 0.9995449185371399}]",0.9995449185371399
977,marketplace guru sepertinya terobosan yang bagus tapi mbok ya istilahnya jangan marketplace,NEGATIVE,b marketplace guru seems like a good breakthrough but maybe the term doesn t mean marketplace,"[{'label': 'NEGATIVE', 'score': 0.947695791721344}]",0.947695791721344
