,Komentar,label,truncated_label,sentiment,score
1415,bener mas kini giliran guru untuk di ojolkan baru ini mendikbudristek dalam rapat dengan dpr menyatakan akan membuat pilar solusi kebutuhan guru yaitu dengan membuat marketplace guru ,POSITIVE,b bener now it s teachers turn to be singled out Recently the Minister of Education and Research and Technology said in a meeting with the DPR that he would create a pillar for solutions to teacher needs namely by creating a teacher marketplace,"[{'label': 'POSITIVE', 'score': 0.9979895353317261}]",0.9979895353317261
1416,persiapan program marketplace guru terus dikebut dipayungi pp rekrutmen guru lebih fleksibel ,NEGATIVE,b preparations for the teacher marketplace program continue to be accelerated under the umbrella of more flexible teacher recruitment PP,"[{'label': 'NEGATIVE', 'score': 0.8539591431617737}]",0.8539591431617737
1417,guru sistem mitra dibayar per trip kemudian ada istilah guru anyep ojol yg dia tinggalkan aja ambles sahamnya sekalipun udah fusion sama marketplace,NEGATIVE,b guru partner system is paid per trip then there is the term anyep ojol guru he just left his shares sinking even though they have merged with the marketplace,"[{'label': 'NEGATIVE', 'score': 0.9996975660324097}]",0.9996975660324097
1418,gunakan marketplace sistem perekrutan guru bakal lebih fleksibel ,NEGATIVE,b using the marketplace the teacher recruitment system will be more flexible,"[{'label': 'NEGATIVE', 'score': 0.9831230044364929}]",0.9831230044364929
1419,mungkin juga perlu dibuat marketplace job sampingan untuk guru untuk menambah income,NEGATIVE,b it may also be necessary to create a side job marketplace for teachers to increase income,"[{'label': 'NEGATIVE', 'score': 0.9827850461006165}]",0.9827850461006165
1420,dulu yang diharapkan memberi angin perubahan kini malah arahnya makin gak jelas fokuslah ke kesejahteraan tenaga pendidik dan pemerataan fasilitas pendidikan dulu nadiem gagas marketplace guru merasa seperti barang dagangan  republika id ,NEGATIVE,b in the past what was expected to give a wind of change now the direction is even more unclear focus on the welfare of teaching staff and the equal distribution of educational facilities,"[{'label': 'NEGATIVE', 'score': 0.997897744178772}]",0.997897744178772
1421, rekrutmen guru bakal melalui marketplace ,NEGATIVE,b teacher recruitment will be through the marketplace,"[{'label': 'NEGATIVE', 'score': 0.9415399432182312}]",0.9415399432182312
1422,aktivis jppi menilai ide marketplace untuk guru justru akan memicu masalah baru ,NEGATIVE,b jppi activist thinks the marketplace idea for teachers will actually trigger new problems,"[{'label': 'NEGATIVE', 'score': 0.9994683861732483}]",0.9994683861732483
1423,marketplace guru nyari guru kayak nyari kang ojhek,NEGATIVE,teacher marketplace looking for teachers is like looking for a motorcycle taxi driver,"[{'label': 'NEGATIVE', 'score': 0.9987002611160278}]",0.9987002611160278
1424,beda nama kesannya beda padahal barangnya sama marketplace  guru kesannya barang coba kalo dibilangnya talent pool system kayak istilah hr itu pasti ga seheboh ini,NEGATIVE,b different names the impression is different even though the goods are the same as the teacher s marketplace the impression is that the goods try if you say the talent pool system like the term hr it s definitely not as exciting as this,"[{'label': 'NEGATIVE', 'score': 0.9994109869003296}]",0.9994109869003296
1425,no i meankalo dia bilang marketplace semua guru masuk ke ruang sekolah bisa rekrut kapan aja itu berarti bukan closed recruitment system kyk misal bumn atau pns kan dia ngedaftar ini dimarket sakit jiwa lu nadiem,NEGATIVE,b no i mean if he says the marketplace all teachers enter the school room can recruit at any time that means it s not a closed recruitment system like for example state owned enterprises or civil servants he registered this in the mental hospital market you re madam,"[{'label': 'NEGATIVE', 'score': 0.9967827796936035}]",0.9967827796936035
1426,punten pak edi ini liputan pas bertemu dpr dan itu solusi yang disampaikan mendikbud  masalah pppk guru p masih bermasalah solusinya marketplace simplenya begitu ,NEGATIVE,b punten Pak Edi this was coverage during a meeting with the DPR and that was the solution that was conveyed by the Minister of Education and Culture the PPPK problem teachers there is still a problem the solution for the marketplace is as simple as that,"[{'label': 'NEGATIVE', 'score': 0.9898023009300232}]",0.9898023009300232
1427,ya ngapain sarjana pendidikan pada ngikut marketplace buat jadi guru sekolah negeri kalo sistemnya begitu mending pada ngelamar dan kerja di sekolah swasta bahkan internasional sekalian ,NEGATIVE,b ya why do bachelors of education join the marketplace to become public school teachers if the system is so much better for applying and working in private schools and even internationally as well,"[{'label': 'NEGATIVE', 'score': 0.9966579675674438}]",0.9966579675674438
1428,kalau dibuat marketplace untuk pengajar mutunya makin hilang tidak ada standarisasi menyeluruh untuk pendidikan seluruh murid indonesia skrg pun begitu kalau ini diterapkan disparitas mutu pendidikan antar pulau makin lebar harus ada standarisasi guru yg baru,NEGATIVE,b if a marketplace is made for teachers the quality will be lost there is no comprehensive standardization for the education of all Indonesian students even now if this is implemented the disparity in the quality of education between islands will widen there must be a new teacher standardization,"[{'label': 'NEGATIVE', 'score': 0.9991366267204285}]",0.9991366267204285
1429,marketplace untuk guru solusi penerimaan pppk ,POSITIVE,marketplace for teachers of pppk acceptance solutions,"[{'label': 'POSITIVE', 'score': 0.7218345403671265}]",0.7218345403671265
1430,waktu dirapat jg lgsg disinggung jangan pakai istilah marketplace tujuannya semacam talent pool guru teknisnya marketplace aku juga nonton live rapat kemarin lgsg tak skip notulensi wkwk,NEGATIVE,b During the meeting it was also mentioned don t use the term marketplace the goal is like a technical teacher talent pool marketplace I also watched yesterday s live meeting lgsg didn t skip the minutes wkwk,"[{'label': 'NEGATIVE', 'score': 0.709606409072876}]",0.709606409072876
1431,siapkan pp baru untuk marketplace guru ,POSITIVE,b prepare new pp for teacher marketplace,"[{'label': 'POSITIVE', 'score': 0.6643760204315186}]",0.6643760204315186
1432, dari sebutan marketplace guru aja udah bikin gelenggeleng kepala diperlakukan seakan komoditas guru udah dibuat ribet dengan banyak aplikasi yang juga marak keluhan ditambah lagi ini sementara masalah mendasar seperti kesejahteraan jalan di tempat,NEGATIVE,b from the term guru marketplace alone it has shaken my head and been treated as if teacher commodities have been made complicated by many applications which are also rife with complaints plus this while basic problems such as road welfare are in place,"[{'label': 'NEGATIVE', 'score': 0.9942522644996643}]",0.9942522644996643
1433,marketplace guru like we are a bunch of molto and rinso,POSITIVE,b marketplace guru like we are a bunch of molto and rinso,"[{'label': 'POSITIVE', 'score': 0.9767176508903503}]",0.9767176508903503
1434,yo  your art is  you already have mad skills now lets get you a legendary marketplace ready to join oix and take it to the next level ,POSITIVE,b yo your art is you already have mad skills now lets get you a legendary marketplace ready to join oix and take it to the next level,"[{'label': 'POSITIVE', 'score': 0.9876480102539062}]",0.9876480102539062
1435,marketplaces is one of our top  money experts find out what he says is the one investment that always pays off and give him a vote if hes your favorite financial guru    ,POSITIVE,b marketplaces is one of our top money experts find out what he says is the one investment that always pays off and give him a vote if hes your favorite financial guru,"[{'label': 'POSITIVE', 'score': 0.9990857839584351}]",0.9990857839584351
1436,pg yakin marketplace dibentuk untuk pangkas alur birokrasi seleksi guru ,NEGATIVE,b pg believes marketplace was formed to cut the bureaucratic flow of teacher selection,"[{'label': 'NEGATIVE', 'score': 0.9947389960289001}]",0.9947389960289001
1437,marketplace guru seleksi pppk guru yg amburadul yg tentu saja telah melibatkan puluhan platform dan website buatan pemerintah kini solusinya adl dengan menambah platform tambahan marketplace guru degradasi profesi guru sedang menukik tajam kencangkan ikat pinggang ,NEGATIVE,b marketplace for teachers the selection of teachers education is in disarray which of course has involved dozens of platforms and websites made by the government now the solution is to add additional platforms to the teacher s marketplace the degradation of the teaching profession is taking a nosedive tighten your belt,"[{'label': 'NEGATIVE', 'score': 0.997260570526123}]",0.997260570526123
1438,mendikbudristek nadiem makarim bakal lakukan rekrutmen guru lewat marketplace ,POSITIVE,Minister of Education and Culture Nadiem Makarim will recruit teachers through marketplace,"[{'label': 'POSITIVE', 'score': 0.9962980151176453}]",0.9962980151176453
1439, trobosan baru dari mendikbudristek untuk percepatan perekrutan  juta guru pppk  mekanisme sistem marketplace guru  mekanisme sistem perekrutan oleh sekolah  mekanisme sistem penempatan pada formasi kurang peminat ,POSITIVE,b a new breakthrough from the Ministry of Education and Culture to accelerate the recruitment of millions of PPPK teachers Mechanism of the teacher marketplace system Mechanism of the school recruitment system Mechanism of the placement system in less interested formations,"[{'label': 'POSITIVE', 'score': 0.9982091188430786}]",0.9982091188430786
1440,mendikbudristek nadiem makarim menyiapkan  solusi untuk mempercepat perekrutan  juta pppk guru yaitu marketplace guru perekrutan oleh sekolah dan penempafan pada formasi kurang pemina ,NEGATIVE,Mendikbudristek Nadiem Makarim prepared a solution to accelerate the recruitment of millions of pppk teachers namely the teacher marketplace for recruitment by schools and placement in formations with less interest,"[{'label': 'NEGATIVE', 'score': 0.9938840270042419}]",0.9938840270042419
1441,mendikbudristek nadiem makarim luncurkan marketplace guru solusi terkini menghadapi krisis guru ,POSITIVE,b mendikbudristek nadiem makarim launches the teacher marketplace the latest solution to face the teacher crisis,"[{'label': 'POSITIVE', 'score': 0.9974445104598999}]",0.9974445104598999
1442,mendikbudristek nadiem makarim bakal lakukan rekrutmen guru lewat marketplace ,POSITIVE,Minister of Education and Culture Nadiem Makarim will recruit teachers through marketplace,"[{'label': 'POSITIVE', 'score': 0.9962980151176453}]",0.9962980151176453
1443,sisa p bakal menggunakan sistem marketplace guru lulus pg pppk makin waswas  ,NEGATIVE,b the rest of the p will use the marketplace system teachers pass pg pppk increasingly worried,"[{'label': 'NEGATIVE', 'score': 0.9989181756973267}]",0.9989181756973267
1444,what marketplace guru apa maksudnya ya  untuk guru lulus pg pppk tahu  lewat ,NEGATIVE,b what marketplace guru what does it mean for teachers passing pg pppk know through,"[{'label': 'NEGATIVE', 'score': 0.9935210347175598}]",0.9935210347175598
1445,rekrutmen guru bakal dilakukan lewat marketplace ,NEGATIVE,bi teacher recruitment will be done through the marketplace,"[{'label': 'NEGATIVE', 'score': 0.9564144611358643}]",0.9564144611358643
1446,jelang perekrutan  juta guru pppk mendikbud ristek nadiem makarim sudah menyiapkan strategi salah satunya dengan menciptakan marketplace guru teknisnya gimana ya ,POSITIVE,B ahead of the recruitment of millions of PPPK teachers the Minister of Education and Culture Nadiem Makarim has prepared a strategy one of which is by creating a marketplace for technical teachers how about that,"[{'label': 'POSITIVE', 'score': 0.9935486912727356}]",0.9935486912727356
1447,rekrutmen guru bakal lewat marketplace ,NEGATIVE,bi teacher recruitment will be through marketplace,"[{'label': 'NEGATIVE', 'score': 0.9127203226089478}]",0.9127203226089478
1448,nadiem siapkan marketplace khusus guru   ,POSITIVE,b nadiem prepares a special marketplace for teachers,"[{'label': 'POSITIVE', 'score': 0.9941011071205139}]",0.9941011071205139
1449,nadiem siapkan marketplace khusus guru   ,POSITIVE,b nadiem prepares a special marketplace for teachers,"[{'label': 'POSITIVE', 'score': 0.9941011071205139}]",0.9941011071205139
1450,wah nadiem bakal ciptakan marketplace khusus guru ,POSITIVE,b wah nadiem will create a marketplace specifically for teachers,"[{'label': 'POSITIVE', 'score': 0.9969645142555237}]",0.9969645142555237
1451,mendikbudristek rancang marketplace untuk perekrutan pppk guru ,POSITIVE,b mendikbudristek designs marketplace for teacher pppk recruitment,"[{'label': 'POSITIVE', 'score': 0.6395655274391174}]",0.6395655274391174
1452,spoon guru brings groundbreaking nutrition intelligence app to google cloud marketplace revolutionizing grocery retail ,POSITIVE,b spoon guru brings groundbreaking nutrition intelligence app to google cloud marketplace revolutionizing grocery retail,"[{'label': 'POSITIVE', 'score': 0.999226450920105}]",0.999226450920105
1453,spoon guru brings groundbreaking nutrition intelligence app to google cloud marketplace revolutionizing grocery retail  ,POSITIVE,b spoon guru brings groundbreaking nutrition intelligence app to google cloud marketplace revolutionizing grocery retail,"[{'label': 'POSITIVE', 'score': 0.999226450920105}]",0.999226450920105
1454,latest news spoon guru revolutionizes grocery retail with groundbreaking nutrition intelligence app on google cloud marketplace read more      ,POSITIVE,b latest news spoon guru revolutionizes grocery retail with groundbreaking nutrition intelligence app on google cloud marketplace read more,"[{'label': 'POSITIVE', 'score': 0.9920650124549866}]",0.9920650124549866
1455, darvin  steel dive liveaboard for sale price  usd located in lombok indonesia to view more boat photos visit the listing at boat guru marketplace heregtgt  if you have any questions message us on whatsapp at    ,NEGATIVE,b darvin steel dive liveaboard for sale price usd located in lombok indonesia to view more boat photos visit the listing at boat guru marketplace heregtgt if you have any questions message us on whatsapp at,"[{'label': 'NEGATIVE', 'score': 0.9941400289535522}]",0.9941400289535522
1456,coba itu reporter dan guru besar ugm nya suruh jalan ke waduk sermo atau bukak food ojol atau bukak marketplace jadi penelitianya jangan dari menu lesehan offline ,NEGATIVE,try the reporters and professors of UGM telling them to go to the Sermo Reservoir or open a food ojol or open a marketplace so don t do research from the offline lesehan menu,"[{'label': 'NEGATIVE', 'score': 0.9991357922554016}]",0.9991357922554016
1457,this  sea ray  sundancer is a spacious and luxurious express cruiser that offers plenty of amenities for extended cruising or day trips located in singapore  price  sgd visit the boat listing at boat guru marketplacegtgt  ,POSITIVE,b this sea ray sundancer is a spacious and luxurious express cruiser that offers plenty of amenities for extended cruising or day trips located in singapore price sgd visit the boat listing at boat guru marketplacegtgt,"[{'label': 'POSITIVE', 'score': 0.9993230104446411}]",0.9993230104446411
1458,id avoid fb marketplace bc you cant guarantee its a driveable quality if you get the car through a service like carfax guru whatever it has to be road ready to be sold at least i believe it has to be,NEGATIVE,b id avoid fb marketplace bc you cant guarantee its a driveable quality if you get the car through a service like carfax guru whatever it has to be road ready to be sold at least i believe it has to be,"[{'label': 'NEGATIVE', 'score': 0.9971954822540283}]",0.9971954822540283
1459,today but only for the marketplace i think is a great feature to find local deals and for cars thats what i like to check there i use over car gurus and any other car sales apps,POSITIVE,b today but only for the marketplace i think is a great feature to find local deals and for cars thats what i like to check there i use over car gurus and any other car sales apps,"[{'label': 'POSITIVE', 'score': 0.9947710633277893}]",0.9947710633277893
1460,attention sailors  share opportunity the current owner is selling a  share of inuka a  jeanneau sun odyssey ds for usd for more boat photos and info visit the listing at boat guru marketplacegtgt  ,NEGATIVE,b attention sailors share opportunity the current owner is selling a share of inuka a jeanneau sun odyssey ds for usd for more boat photos and info visit the listing at boat guru marketplacegtgt,"[{'label': 'NEGATIVE', 'score': 0.9919409155845642}]",0.9919409155845642
1461,thus the idea for retreat guru was born today the platform has become the worlds foremost retreat marketplace expanding across meditation yoga and psychedelic experiences featuring top providers from to ,POSITIVE,b thus the idea for retreat guru was born today the platform has become the worlds foremost retreat marketplace expanding across meditation yoga and psychedelic experiences featuring top providers from to,"[{'label': 'POSITIVE', 'score': 0.9994986057281494}]",0.9994986057281494
1462,top freelance marketplace dedicated to helping professionals like yourself find work  guru  fiverr  nexxt  toptal  upwork  contently  freelancer  designs  envato studio  peopleperhour ,POSITIVE,b top freelance marketplace dedicated to helping professionals like yourself find work guru fiverr nexxt toptal upwork contently freelancer designs envato studio peopleperhour,"[{'label': 'POSITIVE', 'score': 0.6870565414428711}]",0.6870565414428711
1463,my friend there is no alternate marketplace in usa amazon can also retail in usa their own government is questioning its role as a marketplace and a retailer btw how much of its sale is from fashion,NEGATIVE,b my friend there is no alternate marketplace in usa amazon can also retail in usa their own government is questioning its role as a marketplace and a retailer btw how much of its sale is from fashion,"[{'label': 'NEGATIVE', 'score': 0.9979058504104614}]",0.9979058504104614
1464,whats the alternative marketplace in usa,POSITIVE,b whats the alternative marketplace in usa,"[{'label': 'POSITIVE', 'score': 0.9585915803909302}]",0.9585915803909302
1465,binance to withdraw from the canadian marketplace  watcher guru   ,NEGATIVE,b binance to withdraw from the canadian marketplace watcher guru,"[{'label': 'NEGATIVE', 'score': 0.9972443580627441}]",0.9972443580627441
1466, marketplace in their ecosystem theres an item shop that enables players to buy ingame items these items can then be sold to other players additionally the bitsniper marketplace also provides a platform for players to purchase items that are being sold by other players,POSITIVE,b marketplace in their ecosystem theres an item shop that enables players to buy ingame items these items can then be sold to other players additionally the bitsniper marketplace also provides a platform for players to purchase items that are being sold by other players,"[{'label': 'POSITIVE', 'score': 0.9788675308227539}]",0.9788675308227539
1467,phase  upcoming in  qq bitsniper  stable release new minigames nft marketplace defi features burn tax on transactions branded merchandise shootout death match v perpetual beta launch of bitsniper pvp v,NEGATIVE,b phase upcoming in qq bitsniper stable release new minigames nft marketplace defi features burn tax on transactions branded merchandise shootout death match v perpetual beta launch of bitsniper pvp v,"[{'label': 'NEGATIVE', 'score': 0.9955610036849976}]",0.9955610036849976
1468,table of content  introduction to why roadmap tokenomics  marketplace  partnership  conclusion links,NEGATIVE,b table of content introduction to why roadmap tokenomics marketplace partnership conclusion links,"[{'label': 'NEGATIVE', 'score': 0.633949339389801}]",0.633949339389801
1469,entrepreneurs soloprenuers face countless choices amp pain points daily creators battle with too many nuggets howto gurus the only way to cut through all the noise in the marketplace and deliver results is by showing someone you can help them by actually helping them tgif,NEGATIVE,b entrepreneurs soloprenuers face countless choices amp pain points daily creators battle with too many nuggets howto gurus the only way to cut through all the noise in the marketplace and deliver results is by showing someone you can help them by actually helping them tgif,"[{'label': 'NEGATIVE', 'score': 0.9981359243392944}]",0.9981359243392944
1470,q top freelance marketplace dedicated to helping professionals like yourself find work  guru  fiverr  nexxt  toptal  upwork  contently  freelancer  designs  envato studio  peopleperhour  ,POSITIVE,b q top freelance marketplace dedicated to helping professionals like yourself find work guru fiverr nexxt toptal upwork contently freelancer designs envato studio peopleperhour,"[{'label': 'POSITIVE', 'score': 0.7056401968002319}]",0.7056401968002319
1471, justin talks about developing unique knowledge there are lots of productivity gurus out there writing academically and sharing boring studies most of the marketplace is cluttered and full of noise of copycats and unoriginal voices,NEGATIVE,b justin talks about developing unique knowledge there are lots of productivity gurus out there writing academically and sharing boring studies most of the marketplace is cluttered and full of noise of copycats and unoriginal voices,"[{'label': 'NEGATIVE', 'score': 0.9970397353172302}]",0.9970397353172302
1472,theres a place in the modern marketplace for mithridatesasguru probably,POSITIVE,b theres a place in the modern marketplace for mithridatesasguru probably,"[{'label': 'POSITIVE', 'score': 0.6297136545181274}]",0.6297136545181274
1473,estonian  a  marketplace for property backed loans with over  investors is the latest  to gain  approval to trade across the full eu  ,POSITIVE,b estonian a marketplace for property backed loans with over investors is the latest to gain approval to trade across the full eu,"[{'label': 'POSITIVE', 'score': 0.9715782999992371}]",0.9715782999992371
1474,i am sharing the links of my freelance marketplace accounts below for your kind concern  fiverr   upwork   guru   freelancer   linkedin  ,NEGATIVE,b i am sharing the links of my freelance marketplace accounts below for your kind concern fiverr upwork guru freelancer linkedin,"[{'label': 'NEGATIVE', 'score': 0.993519127368927}]",0.993519127368927
1475,vuu is excited to announce that business executive and guru mr tracy maitland will receive his honorary doctor of human letters degree from vuu at this years commencement we recognize his work in the marketplace and for being an advocate and friend of vuu  ,POSITIVE,b vuu is excited to announce that business executive and guru mr tracy maitland will receive his honorary doctor of human letters degree from vuu at this years commencement we recognize his work in the marketplace and for being an advocate and friend of vuu,"[{'label': 'POSITIVE', 'score': 0.9995959401130676}]",0.9995959401130676
1476,looking for the ultimate cruising experience look no further than this  sea ray sundancer  price  sgd  located in singapore for more boat photos and info visit the listing on boat guru marketplace  ,NEGATIVE,b looking for the ultimate cruising experience look no further than this sea ray sundancer price sgd located in singapore for more boat photos and info visit the listing on boat guru marketplace,"[{'label': 'NEGATIVE', 'score': 0.9830201268196106}]",0.9830201268196106
1477,kalo w udah kerja dri sblm lulus kerja pertama di circlek terus keluar krn msk kuliah trs di tengah kuliah jaga counter jd shopkeeper guru les pegawai suprind admin marketplace trs lulus kuliah jadi buruh negara org skrg indahnya hidup,NEGATIVE,b if I ve been working since before I graduated I worked first at circlek and then left because I was in college then in the middle of college guarded the counter became a shopkeeper tutoring staff suprind admin marketplace then graduated college became a state laborer people are now living a beautiful life,"[{'label': 'NEGATIVE', 'score': 0.5800075531005859}]",0.5800075531005859
1478, sothebys wine guru joins nft marketplace blockbar are luxury bottles going digital    is this the future of wine  ,NEGATIVE,b sothebys wine guru joins nft marketplace blockbar are luxury bottles going digital is this the future of wine,"[{'label': 'NEGATIVE', 'score': 0.9629833698272705}]",0.9629833698272705
1479,would you be interested in a proven solution to lower your cost to acquire amp monetize your nonreachable leads and drastically increase your sales cloud tech gurus ctg has an exciting new partner in our solutions marketplace that can do just that c,POSITIVE,b would you be interested in a proven solution to lower your cost to acquire amp monetize your nonreachable leads and drastically increase your sales cloud tech gurus ctg has an exciting new partner in our solutions marketplace that can do just that c,"[{'label': 'POSITIVE', 'score': 0.9975626468658447}]",0.9975626468658447
1480, sothebys wine guru joins nft marketplace blockbar are luxury bottles going digital    is this the future of wine  ,NEGATIVE,b sothebys wine guru joins nft marketplace blockbar are luxury bottles going digital is this the future of wine,"[{'label': 'NEGATIVE', 'score': 0.9629833698272705}]",0.9629833698272705
